<?xml version="1.0" encoding="utf-8"?>
<!-- Created with Liquid XML Studio - FREE Community Edition 7.1.0.1135 (http://www.liquid-technologies.com) -->
<xs:schema attributeFormDefault="unqualified" elementFormDefault="qualified"
  xmlns:xs="http://www.w3.org/2001/XMLSchema">
  <xs:element name="opendataxml">
    <xs:annotation>
      <xs:documentation>Описание данных OpenData в формате XML</xs:documentation>
    </xs:annotation>
    <xs:complexType>
      <xs:sequence>
        <xs:element minOccurs="0" name="data">
          <xs:annotation>
            <xs:documentation>Данные - корневой тэг</xs:documentation>
          </xs:annotation>
          <xs:complexType>
            <xs:sequence>
              <xs:element minOccurs="0" name="table">
                <xs:annotation>
                  <xs:documentation>Таблица с данными</xs:documentation>
                </xs:annotation>
                <xs:complexType>
                  <xs:sequence>
                    <xs:element minOccurs="0" maxOccurs="unbounded" name="row">
                      <xs:annotation>
                        <xs:documentation>Ряд с данными - запись</xs:documentation>
                      </xs:annotation>
                      <xs:complexType>
                        <xs:sequence>
                          <xs:element minOccurs="0" maxOccurs="unbounded" name="col">
                            <xs:annotation>
                              <xs:documentation>Столбец с данными в ряде</xs:documentation>
                            </xs:annotation>
                            <xs:complexType>
                              <xs:simpleContent>
                                <xs:extension base="xs:string">
                                  <xs:attribute name="num" type="xs:unsignedByte" use="optional">
                                    <xs:annotation>
                                      <xs:documentation>Номер столбца в ряде - уникален в пределах одного ряда</xs:documentation>
                                    </xs:annotation>
                                  </xs:attribute>
                                </xs:extension>
                              </xs:simpleContent>
                            </xs:complexType>
                          </xs:element>
                        </xs:sequence>
                      </xs:complexType>
                    </xs:element>
                  </xs:sequence>
                </xs:complexType>
              </xs:element>
            </xs:sequence>
          </xs:complexType>
        </xs:element>
      </xs:sequence>
    </xs:complexType>
  </xs:element>
</xs:schema>
